artist_name,track_name,release_date,genre,lyrics,len,dating,violence,world/life,night/time,shake the audience,family/gospel,romantic,communication,obscene,music,movement/places,light/visual perceptions,family/spiritual,sadness,feelings,topic,age
gaither vocal band,because he lives,2009,country,sweet hold newborn baby feel pride give greater calm assurance face uncertain days live live face tomorrow live fear go know hold future life live live cross river fight life final pain death give victory light know reign live live,40,0.036229831,0.1005722149304921,0.6312721920209758,0.001594896,0.001594896,0.001594896,0.088670848,0.001594896,0.001594896,0.001594896,0.001594896,0.036190364,0.001594896,0.001594896,0.055270582,world/life,0.1571428571428571
tower of power,loveland,2009,jazz,hear loveland little charm know loveland wrap arm walk golden street hand hand lovers meet loveland pretty baby cause true swear hear loveland youthful hearts loneliness enter happiness answer baby girl walk golden street hand hand lovers meet loveland like walk golden street hand hand lovers meet loveland loveland swear true baby come true baby swear baby loveland loveland baby come loveland,62,0.1842189590572685,0.001074114,0.001074114,0.001074114,0.001074114,0.001074114,0.324557974,0.1349010487184361,0.001074114,0.001074114,0.1920477986641761,0.075514593,0.001074114,0.001074114,0.001074114,romantic,0.1571428571428571
"royce da 5'9""",count for nothing,2009,hip hop,count frontin ounce thuggin count nothin backpackers tbone contact wack rapper biometric dialect entire weapon reckless blap like onetwo gun swoop booth federales tryin like like threefour vishis tradin like triple beam seesaw veteran pump want hahaha playin fourfive seveneight niggaz feelin type figure pride lyric commercial,47,0.003289474,0.003289474,0.1408008283579145,0.003289474,0.003289474,0.003289474,0.003289474,0.003289474,0.4758074998417556,0.003289474,0.003289474,0.003289474,0.003289474,0.003289474,0.003289474,obscene,0.1571428571428571
birdman,money to blow,2009,pop,richer richest money bitch yeah come live city young nigga hour champagne diet spill sip encourage probably say cause club owner supply shit everybody past want guess motherfuckin want come look load nigga quit front come like run disney shit goofy flow record captain hook rufio damn roof somebody know shakin somethin cause drumma produce mistake excuse like leave girls constantly seduce hoe lose thoughts say damn roof slip like super bowl help blame famous bitch money blow get let bill fall skin money blow money blow cash money millionaires yeah richer richest certify get cash money business higher ceiling like gucci store later serve smoke roof people pass smash ballin cash deck lamborghinis bentleys vset lens ice black diamonds cartier ferrari spider higher bear bear uptown bear fully load automatic benz paint foreign light bitch bear hustle nigga size keep stuntin money burnin help blame famous bitch money blow get let bill fall skin money blow money blow pay hours money power comecome champagne shower worry bouquet flower kush promise dude smoke bush women second look pop like champagne bottle shake alright hook help blame famous bitch money blow get let bill fall skin money blow money blow,199,0.000411184,0.070884672,0.000411184,0.000411184,0.021492855,0.031022819,0.000411184,0.000411184,0.5760898551908029,0.000411184,0.066039702,0.051735589,0.052639303,0.079543892,0.008390369,obscene,0.1571428571428571
mumford & sons,after the storm,2009,rock,rain come look look knees luck look night push know life decay mind heart take hand stand tall remember land live come time tear break heart dismiss fear heart flower hair cling know exactly true hold hold hold leave guess home know death small scar come time tear break heart dismiss fear heart flower hair come time tear break heart dismiss fear heart flower hair,65,0.051553038,0.1144121210971745,0.093914254,0.051356056,0.000877193,0.000877193,0.1184657418778613,0.000877193,0.000877193,0.000877193,0.1645507700244532,0.000877193,0.000877193,0.3952217027073674,0.000877193,sadness,0.1571428571428571
rebelution,wake up call,2009,reggae,shame somebody show diamonds pearl go wealthy home moonlight road place struggle people treat like human free racism things free money imagery come people look celebrities give community domestic world wide problem people kill demand stay say businessman world leave strand month twice grand things go plan spend see maybe need mentality reality mentality reality yesterday explain buy seventh date feel live life like millions leave ride look star dream like live elite future poorest people message business expand land suffer spend see maybe need mentality reality mentality reality,89,0.000877193,0.028807482,0.3481746685590119,0.000877193,0.000877193,0.000877193,0.000877193,0.1336365506905184,0.000877193,0.000877193,0.1738447332060695,0.034124041,0.1346920047612263,0.000877193,0.053551065,world/life,0.1571428571428571
lmfao,shots,2009,pop,fuck drink ladies gentlemen uhhuh ready fuck lmfao know yeah alcoholics uhhuh yeah walk club yeah eye yeah party crew yeah drink free drink free like cÃ®roc uhhuh patrÃ³n uhhuh come party everybody shots shots shots shots shots shots shots shots shots shots shots shots shots shots shots shots everybody shots shots shots shots shots shots shots shots shots shots shots shots shots shots shots shots everybody ladies pour shots need excuse suck cock suck cock come crunk yeah yeah bottom round shots shots shots shots shots shots shots shots shots shots shots shots shots shots shots shots everybody shots shots shots shots shots shots shots shots shots shots shots shots shots shots shots shots everybody get drink fuck club take shots fuck club come party fuck club alcoholics hand drinkin jÃ¤gerbombs lemondrops buttery nipples jello shots kamikaze wise fuck shit shots patrÃ³n rock ready shots women come time pour shots panties grind time shots cup everybody shots feel drink hand try fuck hand fuck fuck fuck fuck tryna fuck tryna fuck tryna fuck tryna fuck shots patrÃ³n rock ready shots women come time pour shots panties grind time shots cup everybody shots fuck,194,0.000611995,0.000611995,0.000611995,0.039359799,0.1572618703248026,0.000611995,0.000611995,0.000611995,0.6156698162106602,0.000611995,0.1279932255193658,0.016563743,0.035195609,0.000611995,0.000611995,obscene,0.1571428571428571
jay reatard,not a substitute,2009,blues,substitute substitute substitute substitute substitute miss substitute substitute substitute substitute substitute miss,12,0.01754386,0.01754386,0.01754386,0.01754386,0.01754386,0.01754386,0.01754386,0.01754386,0.01754386,0.01754386,0.01754386,0.01754386,0.01754386,0.01754386,0.6842105259887178,feelings,0.1571428571428571
more,hip hop,2009,hip hop,talk talk rapper childish gambino flame cheeto tighter baby speedos shift kilo shit dope walk past rope bouncer folk need credentials sick clique shit inside headlock bear guy legend guy true lie tipsy like jenga shout topangas thicky girls stay wrap finga nerdy girls scope like crew sick hang kid hold mother fucker gambini microphone scream like father come home light girls addict wallet methadone brain dead niggas beef vegetables shit fuck orbit face fuck norbiting feel heat momma hear feet momma,82,0.05136126,0.2616676269814754,0.001169591,0.001169591,0.001169591,0.001169591,0.042202052,0.001169591,0.3220086805466254,0.021761088,0.001169591,0.058965434,0.070192882,0.001169591,0.001169591,obscene,0.1571428571428571
between the buried and me,fossil genera (a feed from cloud mountain),2009,jazz,satellite sweet populous worry free entrance world history underestimate think thoughts satellite tap cloud mountain command ancestors work centuries hear breath watch disease accept truth satellite leaders drive farthest retreat relax enjoy ride speak years night asleep discuss future hold outer space takeover worlds collide dreary predetermine idea bring fellow night owls stories mock ideas crush night control idea think government overthrow come tell prepare night owls speak overhead apocalypse apocalypse happen sooner think read journals station prepare night owls roam earth years keep world afloat stay comfortable precious home sleep discuss discuss future future journals detail instructions machine weapons build weapons begin think harm outside world know false instinct like say discuss plan decades trust essential time explain know soon change trust safe government satellite simple time control simple sky create simple land change simple life break forward fast grow,141,0.000711238,0.048701953,0.3994404383589454,0.091191445,0.000711238,0.000711238,0.019651065,0.166292724,0.000711238,0.037278538,0.063608061,0.094372007,0.044122864,0.000711238,0.000711238,world/life,0.1571428571428571
george strait,give me more time,2008,country,banker farmer discuss line rain crop die vine time gotta time farm family go years pull hard time blood sweat tear time need time little time lovers table candle light wine look answer time gotta time say know heart bind afraid gonna leave mind time gotta time barely hand patient doctor meet close doors kid twentyfour time gotta time time,60,0.001052632,0.097111156,0.001052632,0.3391461976738305,0.025536909,0.052913695,0.001052632,0.001052632,0.001052632,0.001052632,0.1955378809335493,0.001052632,0.001052632,0.1368440501027818,0.001052632,night/time,0.1714285714285714
high school musical cast,walk away,2008,pop,guess know better believe luck change heart forever finally learn name tell time different goodbyes cause survive come stay walk away look cause heart break go hurt know strong late walk away walk walk walk away walk away walk walk walk away wish blame know fault fault shoe know lose emptiness feel familiar goodbye song time surrender cause go yeah walk away look cause heart break go hurt know strong late walk away walk walk walk away walk away walk walk walk away walk away start protect heart soul cause think survive goodbye walk away look cause heart break go hurt know strong late walk away walk walk walk away walk away walk away yeah walk walk walk away walk away walk away walk walk walk away walk away walk away walk walk walk away walk away walk away,139,0.000395726,0.000395726,0.000395726,0.000395726,0.016367538,0.000395726,0.016343778,0.077839911,0.000395726,0.009568637,0.024365331,0.000395726,0.000395726,0.810944501,0.031466032,sadness,0.1714285714285714
jonathan butler,rio,2008,jazz,peanut butter apples bread know peanut butter mess real peanut butter like money spread bread cause funny little peanut butter speak real loud peanut butter give real girl hotter peanut butter spread peanut butter bread jelly need eat shit like stutututer peanut butter chunky smooth eat butter like baseball glove almond butter coconut butter peanut butter peanut butter cause gutter nice stutter gotta wear thunder peanut butter steak prefer blue cheese look fresh capital steeze pass away early peanut butter smooth want clutter smooth yeah mutter straight chill play golf putter peanut butter,93,0.001461988,0.001461988,0.001461988,0.001461988,0.05561522,0.035900006,0.001461988,0.001461988,0.4788444183623573,0.092638334,0.001461988,0.092735638,0.001461988,0.001461989,0.001461988,obscene,0.1714285714285714
demarco,duppy know who fi frighten,2008,reggae,yeahyeah demarco happen demwha happen pree area fear boom duppy know frighten jungle strike lightning problem talk direct place waan step yeah happen duppy know frighten jungle strike lightning problem talk direct bere hothead go place waan stepwha happen fool dehto yeah boom bust proud head crowd head jump like toad blood explode shoot chop head bowl plus shoot sharp like sword corner block road hothead roll dawg patrol step bold heart freezer cold stop bust grow hothead unno soul strap bust taller light pole duppy know frighten jungle strike lightning problem talk direct place waan step yeah duppy know frighten jungle strike lightning problem talk direct place waanshell step yeah boom rise ting tall shoot start hard follow straight morgue cover start bawl lord send straight dead black tell gasoline head light bwoy start know caan fight streets floss like pussy suck madda stop hype yeah duppy know frighten jungle strike lightning problem talk direct place waan step yeah duppy know frighten jungle strike lightning problem talk direct place waan step yeah,173,0.000572082,0.3469650506509643,0.000572082,0.000572082,0.079095501,0.01326858,0.000572082,0.1890446633179267,0.1834255029316641,0.000572082,0.1350375508952084,0.026741784,0.000572082,0.020128461,0.000572082,violence,0.1714285714285714
vampire weekend,the kids don't stand a chance,2008,pop,devastate backstroke shiny shiny cufflinks shirtsleeve enhance pinstriped morning come forward dance pure egyptian cotton kid stand criticize practice murder plant ignore history deny romance pinstriped morning come forward dance fortymillion dollars kid stand like business glance pillow feel soft advance pinstriped morning partner dance paper shoot piece kid stand,50,0.00228833,0.1999032667718307,0.00228833,0.00228833,0.00228833,0.00228833,0.00228833,0.00228833,0.315591829,0.00228833,0.00228833,0.3312276238937209,0.00228833,0.00228833,0.1189523365956372,obscene,0.1714285714285714
indigenous,should i stay,2008,blues,tell look face mind different place tell stay face true leave hard hide feel real tell stay face true leave hard stay face true leave hard,26,0.001949318,0.001949318,0.001949318,0.001949318,0.001949318,0.001949318,0.001949318,0.4366214038668781,0.001949318,0.001949318,0.001949318,0.001949318,0.001949318,0.4913359835840545,0.040853528,sadness,0.1714285714285714
g. love & special sauce,who's got the weed,2008,reggae,weed weed weed weed mamma baby smoke reefer lazy listen cause save young crazy mother praise pass brother cause friend friend plenty friends smoke weed seed roll like cone like tornado pass sucker fast like potato feel finger grip reality start slip exact huge kind vapors pharcyde crew yeah know smoke alot know poke alot know pop japan global cop look like herbal flow tight like know smoke hydroponic chronic claim pure graduate waste waste taste party little average spin lettuce cabbage know paper catch vapors freestyle neighbor know forsake dirt like undertakers let break humble know custom cake listen flake pack crumb shake shake grab crap go airport go slip feds cause house buddha right cool stink damn stewardess look think know try spray body cologne stench creep homegrown backyard pocket want drink worry funky green smokin,138,0.015796822,0.000683527,0.000683527,0.000683527,0.0148422,0.022631418,0.000683527,0.1828806772280677,0.4544311849353114,0.000683527,0.1050067930785774,0.000683527,0.048743605,0.000683527,0.022728276,obscene,0.1714285714285714
marc antoine,funky picante,2008,jazz,wonder lose control heart attack away fall know hardly hold tell truth believe run near wish somebody tell catch need demons lose lead astray guess fool catch girl heart break fade away pass point come rip lungs hard breathe wish somebody tell catch need demons lose lead astray guess fool catch girl heart break know hardly hold tell truth believe know hardly hold tell truth believe wish somebody woulda tell wish somebody woulda tell catch need demons lose lead astray guess fuck fool catch girl heart break fade away know hardly hold tell truth believe fade away know hardly hold tell truth believe fade away,105,0.000584795,0.000584795,0.000584795,0.000584795,0.000584795,0.000584795,0.046145246,0.3933551614059563,0.015661036,0.000584795,0.000584795,0.000584795,0.000584795,0.4564719488286611,0.045270041,sadness,0.1714285714285714
francesca battistelli,free to be me,2008,pop,years look dream wag destiny battle great plan cause couple dent fender couple rip jeans piece perfection enemy clumsy shoulder free girl think figure life turn right things come easy doubt free believe time think good bring look heart tell seek easy believe,43,0.001594896,0.001594896,0.3458456774436844,0.001594896,0.001594896,0.001594896,0.001594896,0.2296246625476274,0.1075149552969685,0.001594896,0.001594896,0.001594896,0.092486745,0.067339159,0.029018515,world/life,0.1714285714285714
ricky nelson,hello mary lou (goodbye heart),2008,rock,hello goodbye heart sweet know hello goodbye heart lips hear voice believe choice wild horse couldn stay away think moonlit night arm good tight say hello goodbye heart sweet know hello goodbye heart yeah lips hear voice believe choice wild horse couldn stay away think moonlit night arm good tight say hello goodbye heart sweet know hello goodbye heart hello goodbye heart hello goodbye heart,65,0.000848896,0.000848896,0.000848896,0.000848896,0.017696883,0.000848896,0.4116139421403335,0.143415224,0.000848896,0.038854476,0.070637814,0.000848896,0.1263530133142197,0.1518247327328815,0.030266054,romantic,0.1714285714285714
the black angels,18 years,2008,blues,control control pain palm hand yeah control need come linen dress know door open let light call take blindfold home woman stand hold knock know heavy beat pound heart start sweat scream black answer dungeon smile curtain surround begin forget hammer crack iron core mind,45,0.001461988,0.4503124385320177,0.001461988,0.001461988,0.055491715,0.001461988,0.072944746,0.055143187,0.001461988,0.041255404,0.001461988,0.041628256,0.001461988,0.2196941562487365,0.001461988,violence,0.1714285714285714
vanilla ice,ice ice baby (club crasher mix),2008,hip hop,kick baby baby right stop collaborate listen brand invention grab hold tightly flow like harpoon daily nightly stop know turn light glow extreme like vandal light stage chump like candle dance rush speaker boom kill brain like poisonous mushroom deadly play dope best felony leave better gang better bull play problem solve check hook revolve baby vanilla baby vanilla baby vanilla baby vanilla party jump bass kick vegas pumpin quick point point fake cook like pound bacon burn quick nimble lyric commercial,82,0.1472680579968578,0.001096491,0.001096491,0.001096491,0.001096491,0.001096491,0.001096491,0.001096491,0.6344011695517273,0.001096491,0.001096491,0.1252161991781766,0.001096491,0.001096491,0.001096491,obscene,0.1714285714285714
lead belly,gallis pole,2008,blues,father bring silver father bring gold bring dear father gallows pole yeah yeah bring gallows pole olden time years prison bar jailhouse twentyfive thirty dollars save gallows pole cause gonna hang bring little money everybody come jailhouse upside jail marry brang comfort come mother mother bring silver mother bring gold bring dear mother gallows pole yeah yeah bring gallows pole bring silver bring gold bring little gallows pole yeah bring yeah bring bring gallows pole come wife wife bring kind clock part change world jailhouse wife bring silver wife bring gold bring dear wifey save gallows pole yeah yeah bring gallows pole friends bring silver friends bring gold bring dear friends gallows pole yeah yeah bring gallows pole,118,0.000649773,0.000649773,0.1192123204825389,0.000649773,0.1479763593824858,0.036001478,0.030000893,0.000649773,0.000649773,0.3253588529171907,0.098774116,0.1276296022713369,0.094554719,0.000649773,0.000649773,music,0.1714285714285714
widespread panic,up all night,2008,blues,sleep night laughin savannah street moon smell sulfur cobblestone night night dream heaven feel like hell children church clothe sunday mornin bell head spinnin take toll night night night night night night best thing years christmas light hide expose night sunrise sunset night night night night night night night,49,0.001349528,0.001349528,0.001349528,0.4027953762492302,0.001349528,0.035951675,0.001349528,0.001349528,0.001349528,0.001349528,0.2881885316036107,0.2247137346243328,0.029457294,0.001349528,0.001349528,night/time,0.1714285714285714
fall out boy,w.a.m.s.,2008,rock,young stick thoughts head stir awake try trick fall asleep woah head heaven sole hell meet purgatory hips hurry hurry head flurry flurry freckle freckle make special make special go leave go teach guild build club know heartwarming inside skin head heaven sole hell meet purgatory hips hurry hurry head flurry flurry freckle freckle make special make special go leave go teach hurry hurry head flurry flurry freckle freckle make special make special go leave go teach mama medication sleep days sleep days mama pray lord sing stage sing stage waste long dark machine want stick want stick golden memory,100,0.000785546,0.3219810891329224,0.114331994,0.000785546,0.000785546,0.068920637,0.000785546,0.000785546,0.024666211,0.046486559,0.000785546,0.043230576,0.0192599,0.058446133,0.088168193,violence,0.1714285714285714
sir charles jones,i tried,2008,blues,wait days grow somber quickly quiet release feel lonely think feel throw aside think feel hurt walk away tear apart believe stand watch bleed thing believe need hold smell hear breath feel body long wait wait come hold feel lonely betray closest friend hurt walk away tear apart believe stand watch bleed long wait feel lonely think feel throw aside think feel hurt walk away tear apart believe stand watch bleed betray closest friend hurt wait,76,0.000773994,0.149997234,0.068385751,0.081965832,0.000773994,0.000773994,0.000773994,0.1175958636295716,0.000773994,0.000773994,0.000773994,0.000773994,0.000773994,0.483368401,0.088624998,sadness,0.1714285714285714
six60,don't forget your roots,2008,reggae,ohoh yeah forget root friend yeah forget family yeah forget root friend ones ones bring forget root friend yeah forget family yeah forget root friend yeah woahyeah good good arm power homeland homeland boot lace tight ticket hand return home lose know whats right break world world lie days number relationships suffer lose matter forget root friend yeah forget family yeah forget root friend ones give ones bring forget root friend yeah forget family yeah forget root friend yeah woah think think head right track right track leave mat gate walk away look lose know whats right brand image world lie days number relationships suffer lose matter forget root friend forget family forget root friend ones give ones bring forget root friend yeah forget family yeah forget root friend yeah woah guitar lead break woah woah yeah forget root friend forget family forget root friend ones give ones bring forget root friend forget family forget root friend yeaheeeh,158,0.000427899,0.000427899,0.4454515454297802,0.000427899,0.139656162,0.000427899,0.018866163,0.1796577928007801,0.000427899,0.000427899,0.093409156,0.000427899,0.076689038,0.029443511,0.012119743,world/life,0.1714285714285714
kings of leon,be somebody,2008,rock,take floor reach loosen loosen lock door rhythm rhyme loosen loosen try recall want shake shake count night beautiful shake shake give go somebody dance go somebody open door go face floor go somebody time know stand hand hand longer ordinary plan hand give go somebody dance go somebody open door go face floor go somebody somebody somebody,58,0.000993049,0.1036465635059751,0.1493612306514489,0.000993049,0.000993049,0.000993049,0.000993049,0.000993049,0.000993049,0.000993049,0.1541085697234814,0.1309958712128475,0.087676948,0.000993049,0.3006761062146963,feelings,0.1714285714285714
arctic monkeys,do me a favour,2007,rock,mourn complete tear steer wheel drip seat hours weeks cheek equally bleak begin go disappear bend tell time tend start break half start fall apart hold heart favour break nose favour tell away favour stop ask question walk away shoe untie eye cry watch wait inside force smile wave goodbye curiosity heavy load heavy hold heavy hold curiosity heavy load heavy hold force cold favour need help say favour stop flatter tear apart tie bind fuck kind fuck kind,79,0.000892061,0.000892061,0.000892061,0.000892061,0.000892061,0.082016815,0.094692287,0.061992737,0.058137562,0.000892061,0.2177710561721187,0.000892061,0.000892061,0.4205161846464136,0.000892061,sadness,0.1857142857142857
tomorrows bad seeds,vices,2007,reggae,wish away vices hold headstrong mind astray someday maybe realize world brighter place play drift away corrupt kings collapse reason politicians pollute breathe force suffer lie believe crook pythons overthrow deceive raise fist cause bear rage voice opinion direct decisions intense visions mental condition help people time soon uplift wish away vices hold headstrong mind astray someday maybe realize world brighter place play drift away know mystery black henchman disposition cross supposedly worlds religion announce loud speaker wouldn listen capitalism organize crime victims goin ones gonna fight fight stop look life mean wish away vices hold headstrong mind astray someday maybe realize world brighter place play drift away corrupt kings collapse reason politicians pollute breathe force suffer lie believe crook pythons overthrow deceive raise fist cause bear rage voice opinion direct decisions see goin scale tell right fight wish away vices hold headstrong mind astray someday maybe realize world brighter place play drift away drift away vices hold drift away,160,0.00055991,0.102132327,0.1409933037593631,0.00055991,0.00055991,0.05171627,0.024959782,0.1683186762862683,0.00055991,0.049384496,0.00055991,0.00055991,0.042023877,0.3919692104914871,0.00055991,sadness,0.1857142857142857
