artist_name,track_name,release_date,genre,lyrics,len,dating,violence,world/life,night/time,shake the audience,family/gospel,romantic,communication,obscene,music,movement/places,light/visual perceptions,family/spiritual,sadness,feelings,topic,age
riley green,i wish grandpas never died,2019,country,wish girls love give ring wish porch swing wish kid learn shake hand wish state birmingham wish everybody know word mama try wish monday mornings felt like friday nights wish cars truck bed road name copperhead coolers cold light wish high school home team lose road drinkin kid catch wish cotton high wish honky tonks close time wish grandpas die wish sunday creek bank wish learn drive wish time seventeen kiss chevrolet happen wish everybody overseas gonna home wish country music play country radio wish cars truck bed road name copperhead coolers cold light wish high school home team lose road drinkin kid catch wish cotton high wish honky tonks close time wish grandpas die die wish good dog grey wish farm sell wish cars truck bed road name copperhead coolers cold light wish high school home team lose road drinkin kid catch wish cotton high wish honky tonks close time wish grandpas die wish grandpas die,157,0.000449843,0.000449843,0.000449843,0.000449843,0.000449843,0.009686033,0.023823357,0.000449843,0.000449843,0.044373771,0.4513455375406036,0.03820736,0.010441354,0.4081135452581409,0.000449843,sadness,0.014285714
b.o.b,back and forth,2019,hip hop,hear go sleep fuck outta room yeah logic beat kick rhyme slow gotta time fuckin know half white half negro guess double talent guess nice tryna like dyke cause famish famish better depths hungary like budapest go death collar bomba cause blow mind like osama word obama action word time drama bring wisdom like dalai lama hear castro hotter take shots tabasco shit constipate flow wonder fuck know homies asshole style define cause definition truth want proof better listen dissin waste time waste amaze rhyme fine homie need help stay dim yeah flow presidential acapella need instrumental sleep leave like seattle wordplay vicious homie wanna scrabble wanna battle shit leave paddle rid somebody saddle wifey livin like matter fact princess cause live like bama execute emotion perpetual grammar cause stamina colder hotter hades spit baby infect rabies fact skin like scabies,141,0.014075978,0.071787624,0.000641849,0.1165458395792435,0.043062905,0.000641849,0.000641849,0.146580273,0.5458416842974338,0.000641849,0.000641849,0.000641849,0.000641849,0.000641849,0.035049389,obscene,0.014285714
granger smith,holler,2019,country,cold can blue box dibble boom aframe rockin grip dirt road couple buddies sayin let gonna burn right grind tonight raise tryin throw little country fade truck line lookin buzz girls boys blue collar holler double rockin flag strap head rack blowin night kerosene pour pile tree step strike match watch friday ignite raise tryin throw little country fade truck line lookin buzz girls boys blue collar holler dibble yeeyee listen bout fuse crack long pouch rip yeah thing packin lips jumpin tailgate poppin like gauge care city boys party damn right yeeyee raise tryin throw little country fade truck line lookin buzz girls boys blue collar holler holler chrous repeat,111,0.00074129,0.00074129,0.00074129,0.069507375,0.01539282,0.046830288,0.00074129,0.00074129,0.3037479632509276,0.063427242,0.4167634599455218,0.033630307,0.00074129,0.00074129,0.00074129,obscene,0.014285714
thee oh sees,poisoned stones,2019,blues,operation night suit eye lay basement awake night alright bake wasteland night suit eye stand corner night want alright bathroom right maybe come shoot silent ceiling puddle floor knock door,30,0.002506266,0.4361805759772598,0.002506266,0.4735537156804082,0.002506266,0.002506266,0.002506266,0.002506266,0.002506266,0.002506266,0.002506266,0.002506266,0.002506266,0.002506266,0.002506266,night/time,0.014285714
iya terra,follow your heart (feat. zion thompson from the green),2019,reggae,wish atlas path feel like go astray know long hard journey go wouldn heart guide focus mission step time analyze vision fall line know gonna okay word ring true want feel spirit darkest days follow heart days hard remember purpose long learn journey season reason follow heart follow heart feel follow heart cause everybody look future want cause crumble tomorrow feel sorrow wonder cause know change near afraid move know grow gonna stop know feel like like remember stay strong weather follow heart days hard remember purpose long learn journey,90,0.000701754,0.000701754,0.3631118023161362,0.06229435,0.015052034,0.000701754,0.000701754,0.094668511,0.000701754,0.000701755,0.000701754,0.000701754,0.014517111,0.1829531870921345,0.088260588,world/life,0.014285714
passion pit,i found u,2019,rock,look look look years bring lower believe light look know yeah know barely alive yeah life fleet feel yeah feel life fleet feel yeah feel believe lyric commercial,28,0.002105263,0.002105263,0.3182446912547721,0.002105263,0.1824601108190843,0.002105263,0.002105263,0.002105263,0.002105263,0.002105263,0.002105263,0.050387385,0.002105263,0.002105263,0.1622465462710329,world/life,0.014285714
ali gatie,it's you,2019,pop,gonna fall know people feel like break heart tear apart know start trust break break delicate break heart trust break break yeah know feel open real hurt yeah hurt inside scar fall gonna fall know people feel like break heart tear apart know start trust break break delicate break heart trust break know best choose lovers know past speak think right baby history repeat cause want yeah want yeah want cause want yeah want yeah thing want gonna fall know people feel like break heart tear apart know start trust break break delicate break heart trust break cause want baby want baby want baby want baby want baby want baby want cause want baby want baby want baby want baby want baby want baby want,125,0.1201335284521625,0.000431406,0.000431406,0.000431406,0.055198916,0.000431406,0.000431406,0.1240737024240321,0.000431406,0.000431406,0.000431406,0.000431406,0.024174089,0.4445427570931547,0.019562151,sadness,0.014285714
the black keys,breaking down,2019,blues,go stumble catch trap somethin bone deep pull know cruel heart ache escape feel like break take ocean sink ship like brick sulk catch ride tide lovin spin round aground heart ache escape feel like break earth shake soul take feel like break break heart ache escape feel like break break,51,0.029421907,0.001253133,0.001253133,0.001253133,0.001253133,0.001253133,0.001253133,0.001253133,0.039762786,0.001253133,0.060051398,0.001253133,0.051000217,0.4312541625694047,0.090837873,sadness,0.014285714
jordan rakei,mindâ€™s eye,2019,jazz,voice head whisper sing sleep dream right catch rain drench memory pain soak sour taste better play mind wide open awaken beast meadow playful hop doorway soul come root cause producer applause mention fault effort need grab inner resource certainly blind force let world take course supersede play mind wide open awaken beast meadow playful hop doorway soul play mind wide open awaken beast meadow playful hop doorway soul brain trap magical maze feel hopelessness face mess brain trap magical maze feel hopelessness face mess play mind wide open awaken beast meadow playful hop doorway soul play mind wide open awaken beast meadow playful hop doorway soul mind mind mind mind mind mind mind mind,115,0.000773994,0.232580731,0.059716765,0.2101457694343622,0.000773994,0.000773994,0.000773994,0.000773994,0.000773994,0.095284263,0.000773994,0.000773994,0.000773994,0.3914365580278763,0.000773994,sadness,0.014285714
rival sons,imperial joy,2019,blues,go stay late things like wide awake crawl long sunday whoawhoa whoawhoawhoa look little blood run vein come kiss thousand years gonna follow follow long wanna school university neverending joke crawl long monday look little blood run vein come kiss thousand years gonna follow follow long look little blood run vein come kiss thousand years know gonna follow follow long say blood run vein come kiss thousand years know gonna follow follow long,73,0.000809717,0.4082835334621184,0.1095258743401136,0.1261942271401616,0.000809717,0.058751416,0.066363102,0.000809717,0.000809717,0.000809717,0.098254277,0.000809717,0.000809717,0.000809717,0.000809717,violence,0.014285714
riley green,in love by now,2019,country,windows roll petty singin tan summer dancin long haired cover band coast know dancin probably girl like stay lonely long somebody doin wrong wouldn good track probably prettyin shotgun seat toenail paint pink raybans holdin blonde hair holdin close night losin sleep know sure thinkin bout probably girl like stay lonely long somebody doin wrong wouldn good track probably yeah probably tonight heart hurt like probably yeah probably probably girl like stay lonely long somebody doin wrong wouldn good track probably yeah probably probably,84,0.000773994,0.000773994,0.000773994,0.1775659216273634,0.045315023,0.000773994,0.000773994,0.1378932670849261,0.3387619036407747,0.022904191,0.000773994,0.000773994,0.000773994,0.058973958,0.09838735,obscene,0.014285714
nappy roots,slums,2019,hip hop,baby leave prophit represent slum alright motherfucker crunkin kentucky baghdad pop go manage come think wattn half bout things bear oakland better know coke see folk soul hear momma cryin know know greet party room pound tryna head straight catchin feel insides burnin musta swallow twentyeight drinkin milk magnesia feelin straight murder granddad realestate hook prophit sample play background lyric commercial,61,0.068976185,0.001814882,0.001814882,0.001814882,0.001814882,0.001814882,0.001814882,0.2829747504987123,0.3573765497565207,0.001814882,0.001814882,0.001814882,0.038059306,0.001814882,0.075745586,obscene,0.014285714
gary clark jr.,the governor,2019,blues,meet friend governor make meet face face fault life choice choose meet friend governor lose yeah meet friend governor make meet face face fault life choice choose meet friend governor gonna lose alright,33,0.002024291,0.002024292,0.5360852629471472,0.002024292,0.041679932,0.002024291,0.002024292,0.002024292,0.002024292,0.002024292,0.165056683,0.002024292,0.002024292,0.002024292,0.002024292,world/life,0.014285714
cedric burnside,ain't gonna take no mess,2018,blues,eastside redemption life know talkin bout woah woah woah woah woah yeah yeah fuck yeah yeah yeah fuck niggas shit stop chasin bitch stop yeah exit bring friend friend friend friends bring friend friend friend friends matte black twodoor door jump wanna score score forearm tattoo squad squad squad squad squad squad squad squad shoot walk room eye wide wide wide eye wide wide wide album comin soon yeah chasin bitch bigger plan stayin stayin tap like dance brick dance diamonds like water water shit foggy clean vvss awesome park baby mama drop death warnin yeah yeah fuck yeah yeah yeah fuck niggas shit stop chasin bitch stop yeah fuck niggas stay outside play outside beat like outside outside outside bring outside money bitch niggas funny shit tell real runnin field duck huntin shit plug reup like boop migo know flip give boop yeah mileage baby ball violence baby trigger finger callus baby bare knuckle talent baby wind deuce line fine crash time limotinted ride ridin toaster toaster better pull championship goin dumb nothin somethin bitch woah woah woah woah woah yeah yeah fuck yeah yeah yeah fuck niggas shit stop chasin bitch stop yeah,195,0.04544351,0.041104781,0.000401768,0.000401768,0.1562903916507739,0.008827587,0.000401768,0.044220732,0.4430896392142172,0.000401768,0.09617353,0.08733772,0.000401768,0.000401768,0.000401768,obscene,0.028571429
bebe rexha,knees,2018,pop,sittin park fight touch best friend laugh barely talk wanna hold hand run run need free knees beg pray close doors open windows follow wind blow scar leave need free knees tonight date wanna place feel like stick place wish read mind instead gotta read eye tell lie wanna hold hand run run need free knees beg pray close doors open windows follow wind blow scar leave need free knees tonight free knees knees free knees need free knees beg pray close doors open windows follow wind blow scar leave need free knees tonight,94,0.000634115,0.3942537721736024,0.000634115,0.048940876,0.071703567,0.000634115,0.040449601,0.057037424,0.022848702,0.000634115,0.000634115,0.067945134,0.120453311,0.09113537,0.000634115,violence,0.028571429
matt maeson,hallucinogenics,2018,rock,pushin past limit trippin hallucinogenics cigarette burn finger cause forget rippin sinners cause fuck beginner crawl life say wouldn live cause couldn open shiftin strong tall push past limit trippin hallucinogenics cigarette burn finger cause forget lyric commercial,38,0.002024292,0.3533997890223332,0.2374832769835498,0.002024292,0.002024292,0.002024292,0.002024292,0.2078865766923218,0.08970754,0.002024292,0.002024292,0.002024292,0.002024292,0.002024292,0.002024292,violence,0.028571429
dierks bentley,"woman, amen",2018,country,ohhhhhh ohhhh ohhhhhh lose lose mind face know save night give drifter heart home night knees lord know near thank woman amen ohhhhhh ohhhh world shake break need crack shatter heart cause get night knees lord know near thank woman amen give ohhhh give ohhhh give ohhhh give strength ohhhh give ohhhh ohhhh thank woman amen ohhhh ohhhhhh ohhhh ohhhhhh thank moon star forgiveness undying twist turn sure roads tonight fall knees cause lord know gonna shout lungs thank woman amen thank woman amen give ohhhh give ohhhh give ohhhh give strength ohhhh give ohhhh ohhhh thank woman amen ohhhh,100,0.000809717,0.084546623,0.3526975422624195,0.065448531,0.000809717,0.1309029058905878,0.1208312532154856,0.063513665,0.000809717,0.000809717,0.000809717,0.044147673,0.017785571,0.093091113,0.000809717,world/life,0.028571429
adam calhoun,huck fosier,2018,country,song fuckin warn comin motherfuckers diss comin door reply lelelet clear country shit hear move inch years stick shiftin gear write rap crayon hosier like dozen fan know fuckin cousin talkin shit throw hand bitch right switch side ride straight midnight wrong tryin half write song half doin shit build ruin time bitch stage grabbin talkin beers drink braggin can camo ammo seethrough talk tough fuck toss trunk punk hillbilly kill fuck chicken summer time buyin chili touch feel choke hater copenhagen dope fuck mistakin hickhop shit vacant hold hold hold hold fuck time redneck rave shit motherfuckers think wasn gonna talk shit sadly motherfuckin mistake check motherfuckers wanna talk gonna piss somebodies boot motherfuckin reason gonna step bitch motherfuckin problem sure motherfuckin truck bitch think harm teeth zone army quit talkin light upstairs nobodies home nobodies shit fight want unlikely stomp wing boot soft shit fuck pull shotgun bullets wreck body body hear bullshit body go check waitin test runnin mouth safety lord mean react mean hear bunch virgins fuck bitch weak verse curtain oppose fact show game,179,0.000491884,0.03302661,0.000491884,0.000491884,0.000491884,0.010676768,0.041684614,0.071796538,0.5902936426382133,0.075162486,0.1064154827005757,0.024317667,0.000491884,0.000491884,0.000491884,obscene,0.028571429
joe bonamassa,molly o',2018,blues,ship fool sail wasn long till aground hear cry hear wail sound thousand souls take gently delve darkness cold like ghost past raise glass highest tide rise bear east glanmire sleepy irish suitcase redemption ticket ship go distress signal send twentytwo surge wall water turn graveyard blue like ghost past raise glass highest tide rise ship fool sail long till run aground hear mamas weep halifax london dance sacred wall watch black water rise ocean dead inside like ghost past raise glass lie truth fell roll gotta rise fall highest tide rise,92,0.000822368,0.4565768821224403,0.000822368,0.000822369,0.000822368,0.000822368,0.000822368,0.000822368,0.000822368,0.1051576664581978,0.000822369,0.1588216820636866,0.000822369,0.1141232549165458,0.000822368,violence,0.028571429
khalid,this way,2018,pop,trippin bullshit shit feel feel stupid corner put shit wanna leave leave foolish leave scar heart leave brand nice true true absolute yeah excuse ruthless reason crazy feel useless take grant wanna play victim know truth leave scar heart true true absolute try stay night inside push away change fight pride,51,0.001283697,0.001283697,0.001283697,0.042188037,0.026130634,0.001283697,0.001283697,0.256604649,0.1420001920268613,0.001283697,0.001283697,0.001283697,0.001283697,0.4608638392708568,0.001283697,sadness,0.028571429
adam calhoun,public enemy,2018,country,fuck care couple beers yeah nothin lose knock chair yeah gonna nigga nothin dude shit nigga nigga fuck black live matter white dude racist like country hold matter fact sayin listen racism time high america judge color judge character write know know cujo know shit large livin charge givin second fore lose temper stomp head aggression fuck american arrogant aware fuckin towel head like wearin allahu akbar sick hearin terrorists home land little kid poppin walk skinny pant fuck suppose sorry object object mean comin motherfuckin neck fuck threat pretend bitch know gender think offensive think fuckin sensitive censor fuck blur middle finger pussy little sister picture fuck care couple beers yeah nothin lose knock chair yeah pupupupublic enemy number see enemy wantin beef runnin country fuck haters point laugh watch church demun jelly struggle gonna simple bitch trouble start break heart action actin learn play fake strong bitch fraud music wish write song catch clip automatic savage tractors white trash deserve better redneck hillbillies shit expose close casket faster close hosier game,173,0.000496524,0.069421542,0.000496524,0.000496524,0.038975074,0.033279272,0.000496524,0.1368776617825341,0.526427449,0.033250583,0.065898977,0.000496524,0.019081112,0.052220745,0.000496524,obscene,0.028571429
meek mill,24/7 (feat. ella mai),2018,pop,tell want yeah tell need yeah night talkin bout monday wednesday thursday friday saturday sunday monday wednesday thursday friday saturday yeah uhhuhuh lovin shit fuckin shit seven days straight live break forever heart forget crushin monday like wednesday press nigga friends benz listen friends babe tell want need mind need right cause sight mind spite decline hype line time respond tell want yeah woah tell need yeah night night night talkin bout monday wednesday thursday friday saturday sunday monday wednesday thursday friday saturday yeah yeah throwin shit like thursday treatin like everyday birthday hoe fuckin worst level like ferg fell pick crown lift finger push puck hear feel bout baby tell hoe wish luck talkin relationship goals kneel like kaepernick reverend stash weddin ready know cause know worst yeah anniversary bout suit birthday cause know thirsty playin gentle rush trust ladies feel help sing yeah yeah talkin bout monday wednesday thursday friday saturday tell want yeah tell need yeah night talkin bout monday wednesday thursday friday saturday sunday monday wednesday thursday friday saturday yeah yeah take gonna best,178,0.032948149,0.000491884,0.03636748,0.1001124407909727,0.1863032446068826,0.000491884,0.000491884,0.1385454354684773,0.3362641615405765,0.014159038,0.057880864,0.000491884,0.000491884,0.020327747,0.016529516,obscene,0.028571429
fall out boy,champion,2018,rock,champion champion call future know mistake past give give headache madness champion people believe champion dream inside dream young believe believe young know believe young know believe yeah live live live live live live champion champion champion champion lyric commercial,40,0.001697793,0.001697793,0.6751242729892297,0.001697793,0.036207579,0.001697793,0.001697793,0.051675107,0.001697793,0.001697793,0.001697793,0.001697793,0.1464758203260873,0.001697793,0.001697793,world/life,0.028571429
katastro,voodoo,2018,reggae,let roll fuck like feel sound fuck promise lose damn chew spit feel like need damn shit take magic swear shit voodoo gotta waste time gotta bring try want know shit voodoo come fuck shit voodoo roll fuck like chew spit promise lose waste time bring try want know shit voodoo come fuck shit voodoo go loose go deuce bond suit grab money grab loot hop coup hop plane yeah jumpin need parachute fuck shit tell grab bag time feel nothin anymore feel good feel gold fuck shit tell grab bag time feel anymore feel good feel gold golden golden golden,101,0.000634115,0.000634115,0.064944117,0.054830807,0.025225831,0.000634115,0.000634115,0.1073070418732862,0.4744315103366489,0.000634115,0.000634115,0.066046298,0.000634115,0.000634115,0.1408214221691437,obscene,0.028571429
mat kearney,face to face,2018,rock,breakthrough hours hear truth moments trade fake kiss chance forfeit afraid miss feel thunder pourin like rain mountains mistake roll like rivers run ocean embrace hand lead thousand horse couldn pull away hear music heaven stand stand face face face face nights regret swear live rear view compare feel thunder pourin like rain mountains mistake roll like rivers run ocean embrace hand lead thousand horse couldn pull away hear music heaven stand stand face face face face face face face face face face face face face face face face face face face face hand lead thousand horse couldn pull away hear music heaven stand stand face face face face face face face face face face,115,0.000521105,0.6249700701442565,0.000521105,0.000521105,0.000521105,0.000521105,0.000521105,0.000521105,0.000521105,0.058886044,0.000521105,0.054927758,0.000521105,0.1333155800105878,0.021479383,violence,0.028571429
the elovaters,hold on,2018,reggae,hold money tight go hold hold hold hold hold light spark hold hold hold hold go swim shark couldn freeze sturdy heart turn color golden stay fade away hold money tight go hold hold hold hold hold light spark hold hold hold hold walk dark hard sturdy heart shine light follow stay fade away stay fade away hold money tight go hold hold hold hold money tight go hold hold hold hold money tight light stick dark heart hold,79,0.000701754,0.000701754,0.000701754,0.000701754,0.000701754,0.000701754,0.4768356716268184,0.000701754,0.1004722595404371,0.000701754,0.000701754,0.1605412295015774,0.000701754,0.1767864190811481,0.062157062,romantic,0.028571429
jeezy,higher learning,2018,hip hop,need weed somebody weed tryna high tryna high yeah somebody weed westside nigga nigga yeah yeah yeah yeah whassup tryna high higher learn nigga look wake ritz damn face face rack jeans waist snow leave shit waste yeah know sip straight like taste haha valet dollars stunt stunt pull mean machine leave arrarr pass thing barely know know imagine shit bout yeah snow streets cold bitch polar polar expectations world think solar yeah kalamazoo cause happen learn soda yeah need weed somebody weed tryna high tryna high bake cake rise motivate factor liver boast bang pour pain thing purple rain brain unravel flame maintain fame picture frame hood blow kush game foot cane walk like indian chief beef real brief wreath think leaf residue stick deep teeth smoke dogg shit cause crip need need weed somebody weed tryna high tryna high coffee good drop fresh know stop somebody weed fiending daydream time mota different kinds fell hard funk fake smoke good smoke shake nugs weed paper twist bowl blunt split sheeit shit cause green scene fuck,176,0.000482859,0.000482859,0.000482859,0.000482859,0.1213587044314403,0.000482859,0.000482859,0.0386611,0.5580196122435054,0.000482859,0.000482859,0.1607161564795992,0.000482859,0.035674234,0.079293032,obscene,0.028571429
waka flocka flame,rock hop (feat. wooh da kid),2018,hip hop,wooh icey boys build flocka hexo flocka flocka flocka shake head wild shake head wild shake head wild party everybody drink smoke wild drink smoke wild drink smoke wild party everybody know waka flocka flame drink crunk chain cause wild pistols like cowboy beat crowd like hotter icey boys beat vision flock duck tat like biker shake head wild shake head wild shake head wild party everybody drink smoke wild drink smoke wild drink smoke wild party everybody drink party hard smoke joke smoke croak mosh quit roll tell shit better right break glass bottle stay throw night bottle cut tight grip matter fuck slip pump fist amped like tat chest wrists hexo waka flocka thing like gutter game maintain like jump stage buss skulls like club owners security piss shake head wild shake head wild shake head wild party everybody drink smoke wild drink smoke wild drink smoke wild party everybody shake head wild kush loud geeked fuck bend lungs go blow pound glock wild child snipe mile mean smile shake head wild shake head wild shake head wild party everybody drink smoke wild drink smoke wild drink smoke wild party everybody,193,0.000358038,0.000358038,0.000358038,0.000358038,0.000358038,0.000358038,0.000358038,0.000358038,0.3804280659118614,0.000358038,0.4817817804826883,0.008881988,0.1235375961776519,0.000358038,0.000358038,obscene,0.028571429
