artist_name,track_name,release_date,genre,lyrics,len,dating,violence,world/life,night/time,shake the audience,family/gospel,romantic,communication,obscene,music,movement/places,light/visual perceptions,family/spiritual,sadness,feelings,topic,age
lou donaldson,everything i do gonna be funky (from now on),1995,jazz,yeah remember funky mama yeah yeah best record baby badass yeah yeah good tune alligator bogaloo yeah bogaloo yeah midnight creeper yeah midnight creeper yeah play funky music baby know know funky music know cause play gonna funky play gonna funky play gonna funky play gonna funky play gonna funky play gonna funky play gonna funky play gonna funky play funky play funky play funky wanna stop funky funky funky,70,0.053367459,0.001096491,0.001096491,0.001096491,0.2044450673168294,0.022641087,0.001096491,0.054609706,0.001096491,0.3652445599101443,0.001096491,0.029942963,0.001096491,0.001096491,0.022426842,music,0.3571428571428571
george strait,fly me to the moon,1995,country,speak know kinda need break maybe moon play star spring like jupiter mar word hold hand word baby kiss heart song sing forever long worship word echo true word word hold hand word baby kiss heart song sing forever long worship word true echo word word word,47,0.055033106,0.001253133,0.001253133,0.001253133,0.001253133,0.001253133,0.2553308642370653,0.077080471,0.001253133,0.4029550686310808,0.001253133,0.051148628,0.001253133,0.053238178,0.001253133,music,0.3571428571428571
john lee hooker,chill out (things gonna change),1995,blues,days things gonna change days ting gonna change baby afterwhile gonna gonna days lonely baby cry long long things gonna change middle night long long long ting gonna change things gonna change change change change ting gonna change road baby things gonna change change change change change change change change baby leave gonna time time baby things gonna change change change change change change change things gonna change things gonna change change change change change change change change change change change change change things gonna change things gonna change things gonna change things gonna change change change change things gonna change,101,0.052598556,0.000537057,0.6727184039732776,0.052213054,0.000537057,0.000537057,0.000537057,0.000537057,0.000537057,0.000537057,0.000537057,0.000537057,0.000537057,0.030724694,0.000537057,world/life,0.3571428571428571
meshuggah,soul burn,1995,jazz,inner perception trap soul cage human wreckage leave liquid face sense blur mind life obscure visual progressions leave peace subliminal merger clutch fence need desperation real flawless confusion void emptiness reign truth eye flash youth memory nuances pass life fray picture mass insidious deception feel fade ravenous mirror praise blacken reality line subsequently forever turn lifetime endless burn soul mind step step take past burn fear lie lose moulder oblivions grasp make soul burn burn astray mind sieged soul forever chain tear cold tell truth lie disbelief cover eye endlessly lose moulder perpetual pain soul burn piece strange wrap disguise reflections life vague eye picture draw naked bare lie make sense live mess constant rest enemy soul flame gain pulse breed inside pressure increase drown belief unveil burn burn,129,0.000711238,0.5610896534352934,0.1180839935085216,0.000711238,0.000711238,0.000711238,0.000711238,0.000711238,0.000711238,0.000711238,0.000711238,0.095440676,0.038444339,0.1272887689533362,0.022962742,violence,0.3571428571428571
ll cool j,loungin (who do ya luv),1995,pop,ummgo head daddy llaughsgo head baby baby doin miss queen hear like lace cream dolce gabbana moschino jeans slip throw fiend playin like cause dress knowin woman need versace gold link stomach chain rock official hair style stick spot makin weak fallin asleep phone peep dyin creep tween sheet chanel feet platter make mission complete wanna lounge sure gotta jewel actin funny style watchin watch money pile protect treasure glass house soon turn corner turn blow frontin chrome leave bless cash mean finesse moral story woman need kind socalled players dream play hand byebye wanna lounge sure gotta sure know sure gotta cash flow escrow damn away like presto alakazam money money fakin jack throwin rock hand nino roller polar smokin beedies model bikinis pushin whip wyck steamy burn turn teach jewel learn twist get money wrong wanna night long go wanna lounge sure gotta sure know sure sure repeat cool adlibs,152,0.027066409,0.000565931,0.000565931,0.000565931,0.000565931,0.000565931,0.04068323,0.1164731097816593,0.4821211576434324,0.000565931,0.2428833820122723,0.036107222,0.000565931,0.000565931,0.000565931,obscene,0.3571428571428571
the grace thrillers,around god's throne,1995,reggae,night close hymn perverse purposeless haunt ears guide step lightless valley eye deceive nature chaos cacophony shroud smoke altars heap stillborn carcasses molech nostrils fill hades bloodlust thrill creatures worship flesh sacrifice souls death mind slave feeble heart deception sculptor destruction devolution name progress fall deprave crown villainy power justice evade midwife hand outstretched gaia travail bring forth finalborn blood wrath misery long afterbirth turmoils fulfil weep amidst agony blood souls forever spill thousand time almighty stay hand dragon muster darken star assault throne poison wellspring life turn curse quench source annihilation beauty veil revilers deceivers kneel kiss edge sword soul calm fear morning hide face near rest heart know night dark daylight deny close hand,116,0.001196172,0.3980900195689937,0.001196172,0.1156904541253229,0.001196172,0.001196172,0.1551808767475857,0.001196172,0.001196172,0.001196172,0.001196172,0.1932368216945116,0.001196172,0.091879424,0.001196172,violence,0.3571428571428571
robben ford & the blue line,chevrolet,1995,blues,chevrolet chevrolet chevrolet somethin somethin ring ring ring somethin somethin yeah build house home build house home build house home somethin somethin chevrolet chevrolet chevrolet somethin somethin,27,0.002392345,0.1212466752351476,0.002392345,0.002392344,0.04784689,0.002392345,0.002392344,0.002392344,0.5325034665419188,0.2625178,0.002392345,0.002392345,0.002392345,0.002392345,0.002392344,obscene,0.3571428571428571
tricky,brand new you're retro,1995,jazz,know know fantastic fuckin plastic dedicate medicate bend break overrate small piece breathe take second wreck sucka niggas believe stress test shit impress walk crew fuck cause think brother check chromosome brand retro pass onetwo cue bullet head bullet head know joke fuck doin gonna represent intention need mention scar bar bar scar result rage brand retro brand retro brand retro scar step fall thunder pick slap wall maniacal cuff manacle mechanical supernatty talk walk exotic spice mouth tame mean careful face see dread past fear future maniacal cuff manacle mechanical supernatty brand retro brand retro brand retro brand retro brand retro brand retro bullet head know joke fuck doin represent intention need mention scar bar bar scar result rage brand retro brand retro brand retro brand retro brand retro brand retro brand retro brand retro brand retro brand retro brand retro brand retro,144,0.000701754,0.203110451,0.000701754,0.000701754,0.000701754,0.000701754,0.000701754,0.083769625,0.5293783215580445,0.000701754,0.153687298,0.000701754,0.000701754,0.000701754,0.000701754,obscene,0.3571428571428571
green day,panic song,1995,pop,ready cheap escape brink selfdestruction widespread panic break glass inside head bleed thoughts anguish mass confusion world sick machine breed mass shit desolate conclusion void care plague inside eat disposition leave tear reality state opinion limp hate world sick machine breed mass shit desolate conclusion void care wanna jump wanna jump wanna jump wanna jump,55,0.001754386,0.3285409345087245,0.1114342001375795,0.001754386,0.001754386,0.001754386,0.001754386,0.001754386,0.1692312736394866,0.001754386,0.001754386,0.001754386,0.001754386,0.1200928803412681,0.001754386,violence,0.3571428571428571
the cranberries,everything i said,1994,pop,make lonely make lonely waitin make tire make tire inside linger heart believe waitin say mean inside head holdin die tonight hold hand understand live spite disappear surely surely lonely lonely,31,0.001949318,0.093684055,0.097391404,0.164947692,0.001949318,0.001949318,0.061289702,0.1822494518847452,0.001949318,0.001949318,0.001949318,0.001949318,0.001949318,0.3750965633630595,0.001949318,sadness,0.3714285714285714
tesla,games people play,1994,rock,game people play night everyday meanin sayin mean waol away hours tower cover flower black limousine break hearts goodbye cross hearts cept blame gaze thinkin bout things dirty rotten shame latten latten latten latten talkin bout game people play people walkin singin hallelujah sayin hell lord gonna teach meditate read horoscope cheat fate brother gonna elevate come board look tell happenin serenity remember cause givin sanity pride vanity turn humanity damn damn latten latten latten latten talkin bout everybody talkin bout talkin bout game game play latten latten latten latten latten game talkin bout game people play latten latten latten latten repeat fade,103,0.000785546,0.000785546,0.1337759175394598,0.000785546,0.000785546,0.021408518,0.032492378,0.000785546,0.6777144827994954,0.000785546,0.000785546,0.000785546,0.000785546,0.092749413,0.000785546,obscene,0.3714285714285714
keb' mo',henry,1994,blues,remember cotton pick hand dixy southern work remember lighten whiskey blue breese sweet magnolia tree little church house chourus hear delta call light distant future feel past play steel guitar ohhh time free crime shame blame time move chours hear delta call light distant future feel past play steel guitar play steel guitar hear delta call light distant future feel past play steel guitar play steel guitar,67,0.001119821,0.001119821,0.2356173500384218,0.001119821,0.001119821,0.038876828,0.001119821,0.001119821,0.001119821,0.4136798645761224,0.1210776876835094,0.085845958,0.029533609,0.001119821,0.061930852,music,0.3714285714285714
the stone roses,love spreads,1994,rock,spread arm wait nail forgive prevail come cross hide tree picnic yeah yeah yeah yeah yeah yeah yeah scream sound forgive leave cold black skin naked rain hammer flash lightning hurt picture mean messiah sister queen picture mean lyric commercial,40,0.001547988,0.339411198,0.072551359,0.001547988,0.2103987436522348,0.032207546,0.001547988,0.001547988,0.001547988,0.001547988,0.001547988,0.1135422067592391,0.001547988,0.1458934545787585,0.001547988,violence,0.3714285714285714
vince gill,if i had my way,1994,country,live brothers fuss fight hungry innocent die away burden hurtin hatred lie lonely little kid cry maybe wall come lose turn fuss fight frighten little kid cry,27,0.002506266,0.311678812,0.002506266,0.002506266,0.002506266,0.1047471723781604,0.002506266,0.002506266,0.002506266,0.002506266,0.002506266,0.002506266,0.2196925465147207,0.3262874823191899,0.002506266,sadness,0.3714285714285714
portishead,numb,1994,pop,lose search see turn turn deceit cause child light try reveal feel understand anymore cause feel lonely feel unholy cause child light try reveal feel loneliness leave fool somebody faithless path roam deceive breath secretly silence silence cause child light try reveal feel loneliness leave loneliness leave lady lady,49,0.065358809,0.001422475,0.001422475,0.001422475,0.001422475,0.001422475,0.001422475,0.1367651207592954,0.001422475,0.001422475,0.001422475,0.1702688931817064,0.079333748,0.3851319438569413,0.1446493085615978,sadness,0.3714285714285714
alice cooper,it's me,1994,blues,take firstclass paris dance streets spain follow janeiro sick tire london rain late night close tire eye need die clear baby near play card felt sorrow dealer deal pain baby gonna play tomorrow stake damn high break money blow luck go search know door know sin sit change break heart piece babe strange angry come go arm wide open girl catch fall someday realize belong luck go need die clear baby near search know door know sin baby,78,0.1277899794890605,0.000762777,0.080687541,0.000762777,0.000762777,0.000762777,0.000762777,0.000762777,0.133312992,0.000762777,0.000762777,0.1754071847103641,0.000762777,0.3905122191282147,0.067125869,sadness,0.3714285714285714
capleton,equal rights,1994,reggae,equal right justice rise fall tell boom gonna nuff true gonna slew yaaaw think live small world wicked think live small world think live small world tough think live alright come shall stand wicked fiyah gettin come escape come shall hand bomb bayonnettes bullets come emperor selassie shall rise ghetto yute outta slum face evil human race things place away space true owna judgement taste caan escape sadness send people smile face escape today caan escape tomorrow sure anytime borrow sure dont life sorrow sure lead straight like arrow sure brain push borrow sure coke parro yeah sure meditation narrow judgement waan tell sumpn remain hail rastafari watch go flame innocent go drain shackle chain wash brain gun cocaine sick lame alright,122,0.000657895,0.2563768339278254,0.3171006554389654,0.000657895,0.015091071,0.000657895,0.000657895,0.140708949,0.051523042,0.000657895,0.000657895,0.032292646,0.096791116,0.000657895,0.000657895,world/life,0.3714285714285714
pearl jam,not for you,1994,rock,restless soul enjoy youth like hit truth escape common rule hate small table sit crowd room come storm room dare belong scream friends friends scream friends friends sacred come youth dedication naive true power remember fuck yeah,37,0.001949318,0.365249623,0.1164749881572004,0.001949318,0.038986355,0.001949318,0.001949318,0.1463569191863852,0.073223931,0.001949318,0.2343670518745032,0.001949318,0.001949318,0.001949318,0.001949318,violence,0.3714285714285714
lead belly,ain't it a shame to go fishin' on sunday,1994,blues,shame fishin sunday shame shame fishin sunday shame shame fishin sunday monday wednesday thursday friday saturday shame shame drink sunday shame shame drink sunday shame shame drink sunday monday wednesday thursday friday saturday shame shame beat wife sunday shame shame beat wife sunday shame shame beat wife sunday monday wednesday thursday friday saturday shame fishin sunday shame shame fishin sunday shame shame fishin sunday monday wednesday thursday friday saturday shame shame shame shame shame shame,75,0.001052632,0.001052632,0.5889594511652207,0.001052632,0.001052632,0.001052632,0.001052632,0.001052632,0.001052632,0.001052632,0.3331458119173055,0.001052632,0.001052632,0.001052632,0.001052632,world/life,0.3714285714285714
the mavericks,i should have been true,1994,country,hold hand know wrong time hold tight true blue shouldn wonder go know wrong eye lips touch miss nights long go time hold tight true blue shouldn wonder go know wrong true blue shouldn wonder go know wrong,38,0.001461988,0.001461988,0.001461988,0.1041468449900102,0.001461988,0.001461988,0.3420076104947406,0.2798371802737072,0.001461988,0.1070902030625927,0.001461988,0.001461988,0.001461988,0.001461988,0.1464503247273322,romantic,0.3714285714285714
k. s. chithra,kehna hi kya,1994,pop,artist artist idol idol care proud proud ìžìœ ë¡­ë„¤ irony irony ë‚˜ì˜€ê¸°ì— ì†ê°€ë½ì§ˆ know know know want know want change change trade trade ë– ë“¤ì–´ëŒ€ì…” talkin talkin talkin stop lovin stop lovin stop lovin ohohowoah ohohowoahowoah ohohowoah ì¿µë”ëŸ¬ëŸ¬ ohohowoah ohohowoahowoah ohohowoah ì¿µë”ëŸ¬ëŸ¬ face spotlight ìŠˆí¼ížˆì–´ë¡œê°€ anpanman ì´ì‹­ì‚¬ì‹œê°„ì´ thang thang fan dance ë‚˜ì´ê¸°ì— ê³ ë¯¼ë³´ë‹¤ëŠ” runnin runnin runnin ë– ë“¤ì–´ëŒ€ì…” talkin talkin talkin stop lovin stop lovin stop lovin ohohowoah ohohowoahowoah ohohowoah ì¿µë”ëŸ¬ëŸ¬ ohohowoah ohohowoahowoah ohohowoah ì¿µë”ëŸ¬ëŸ¬ fine ëŒì•„ê°€ë„ okay mymy okay stop lovin stop lovin ohohowoah ohohowoahowoah ohohowoah ì¿µë”ëŸ¬ëŸ¬ ohohowoah ohohowoahowoah ohohowoah ì¿µë”ëŸ¬ëŸ¬,89,0.219904094,0.001253133,0.001253133,0.001253133,0.001253133,0.001253133,0.001253133,0.1218049316405455,0.3094953404939285,0.001253133,0.001253133,0.001253133,0.001253133,0.001253133,0.001253133,obscene,0.3714285714285714
kenny loggins,cody's song,1994,rock,feel afraid lose smile eye bring moon sky remember darling promise promise comfort darling learn want years lullaby heart child remember darling promise promise comfort darling hold feel music heart need listen sing sing grow away matter change know tire life sure home turn quiet close eye listen inside unconditional unconditional unconditional sing promise promise comfort sing darling anytime,59,0.001012146,0.001012146,0.3171386162496887,0.001012146,0.001012146,0.001012146,0.1859163566355316,0.001012146,0.001012146,0.2235666928675784,0.001012146,0.068281003,0.001012146,0.1417000924371055,0.0300585,world/life,0.3714285714285714
the offspring,what happened to you?,1994,pop,world happen start tokin brain simplest things draw little picture hand explain understand losin junk abusin world happen take know kind person kind explain understand losin junk abusin world happen losin junk abusin world happen sympathetic little slack think will little morning night refrain face life tomorrow gackin coffin time spend think time try lend hand explain understand losin junk abusin world happen world happen world happen,67,0.001144165,0.062580976,0.3564793413988236,0.07658157,0.001144165,0.074733559,0.001144165,0.4136062468893179,0.001144165,0.001144165,0.001144165,0.001144165,0.001144165,0.001144165,0.001144165,world/life,0.3714285714285714
cracker,sick of goodbyes,1993,country,stupid mind thoughts cross land drag locomotives ocean know like second click change dust wither root hair knot rust wad currents ocean sick goodbyes goodbyes sick goodbyes goodbyes tire goodbyes goodbyes goodbyes goodbyes goodbyes night come crawl fours soak dream floor sick sick goodbyes goodbyes goodbyes goodbyes sick goodbyes goodbyes tire goodbyes goodbyes sick sick goodbyes goodbyes goodbyes goodbyes goodbyes,60,0.001879699,0.6608312228908612,0.058887982,0.001879699,0.001879699,0.001879699,0.001879699,0.0018797,0.001879699,0.001879699,0.001879699,0.2502056056704956,0.001879699,0.001879699,0.001879699,violence,0.3857142857142857
ub40,now and then,1993,reggae,admit wonder vanquish foes glance perfect single drive rain come blame anybody misery contemplate different simple word content walk tall peace mind leave childhood dream arrive home things know ought admit wonder vanquish foes glance perfect single drive rain come blame anybody misery hit like bricks realise lick angels look rainbow gold cloak shield cold pill stop grow dream fade stark reality,62,0.00131579,0.00131579,0.3008457363461315,0.00131579,0.001315789,0.001315789,0.001315789,0.00131579,0.00131579,0.00131579,0.1398635646117285,0.06613505,0.00131579,0.2628627330474871,0.001315789,world/life,0.3857142857142857
the cranberries,pretty,1993,pop,pretty pretty reason insolent pretty want change want change pretty pretty reason insolent pretty want change want change,18,0.003095975,0.003095975,0.3560371515910031,0.003095975,0.003095975,0.003095975,0.003095975,0.003095975,0.003095975,0.003095975,0.003095975,0.003095975,0.003095975,0.003095975,0.003095975,world/life,0.3857142857142857
bad religion,skyscraper,1993,pop,come bricks burn hard build city tower world climb reach propose build tear like skyscraper build tear join wall climb know think catch away like spoil little baby come play revenge build tear like skyscraper build tear join wall climb madness reign paradise drown babel wall come crash echo roar story writ hardly understand good build tear like skyscraper build tear join wall climb build build,66,0.0644668,0.445129945,0.001096491,0.001096491,0.001096491,0.02803754,0.001096491,0.001096491,0.001096491,0.001096491,0.001096491,0.1429505213892722,0.001096491,0.2046106183900527,0.022396702,violence,0.3857142857142857
mariah carey,without you,1993,pop,forget even face leave guess story go smile eye sorrow show show forget tomorrow think sorrow fair know know live live live anymore live live anymore forget even face leave guess story go smile eye sorrow show live live live anymore live live live anymore live live live live live live live anymore live live live,56,0.000923361,0.000923361,0.6635876385238845,0.000923361,0.000923361,0.000923361,0.000923361,0.2527160882775999,0.000923361,0.000923361,0.000923361,0.068922496,0.000923361,0.000923361,0.000923361,world/life,0.3857142857142857
babyface,when can i see you,1993,pop,heart beat pain tear stop run begin hear sayin swear make sense heart beat breathe someday begin truly suppose baby baby hear sayin make sense heart beat baby breathe yeah baby hear sayin make sense baby heart beat baby yeah baby breathe wanna,43,0.180663282,0.2452758198084885,0.00122399,0.00122399,0.048387754,0.00122399,0.00122399,0.00122399,0.085187306,0.00122399,0.00122399,0.00122399,0.00122399,0.3057316894015805,0.00122399,sadness,0.3857142857142857
con funk shun,straight from the heart,1993,jazz,spell mind blame life thing forever straight heart doubt till time time believe completely turn world know pull want word forever straight heart doubt till time time straight heart doubt till time time straight heart doubt till time time ohoh straight heart doubt,43,0.001283697,0.001283697,0.2968059552903394,0.3044818082420105,0.001283697,0.001283697,0.001283697,0.001283697,0.1376994171033421,0.001283697,0.001283697,0.001283697,0.001283697,0.2149327185599012,0.001283697,night/time,0.3857142857142857
tim mcgraw,memory lane,1993,country,people doin gonna drive insane followin rain like road years wind trail tear walkin memory cause know runnin reminiscin pain recallin things lookin flame heartbreak avenue walkin memory cause know runnin hate love mind keep goin train think wear track night occasion memory meet endless lonely street break dream walkin memory cause know runnin reminiscin pain recallin things lookin flame heartbreak avenue walkin memory cause know runnin walkin memory cause know runnin reminiscin pain recallin things lookin flame heartbreak avenue walkin memory cause know runnin come walkin walkin memory walkin memory walkin walkin memory lord walkin memory walkin walkin memory walkin walkin walkin memory walkin walkin memory,107,0.000572082,0.000572082,0.000572082,0.000572082,0.000572082,0.012898551,0.013940124,0.074753707,0.4601473128884969,0.000572082,0.035104431,0.055985639,0.000572082,0.297594678,0.000572082,obscene,0.3857142857142857
cocteau twins,evangeline,1993,pop,sorrow let define know impression make people go stop feel grow grow go stop feel fantasize princess queen ought feel people go stop feel grow grow go stop feel feel go stop feel grow grow go stop feel fantasize survive famous artist everybody take seriously understand fantasize survive,48,0.001349528,0.001349528,0.3223681051279992,0.001349528,0.027724851,0.001349528,0.001349528,0.001349528,0.001349528,0.001349528,0.001349528,0.001349528,0.06129504,0.001349528,0.3690588210670045,feelings,0.3857142857142857
yanni,only a memory,1993,pop,tear speak seal lips word maybe remember word hear know want truth haunt memory late relight stop burn flame die inside tell late form smile years tear reminisce time share give care feel weere tell late relight stop burn flame die inside babyhow tell late form smile years tear realize longer hop pain ease time leave goodbye know inside realize tell late form smile years tear tell late form smile years tear,72,0.000848896,0.000848896,0.089736826,0.079403909,0.000848896,0.000848896,0.040445032,0.2614084667931972,0.000848896,0.000848896,0.000848896,0.035762738,0.000848896,0.4489697393427017,0.000848896,sadness,0.3857142857142857
us3,lazy day,1993,jazz,lazy days lazy days sittin lounge chair stone cold maxin thinkin bout gonna concert goin beserk today today cold chillin right dippertyday partner store roll illy coolin rule cause go school lampin girl travel round world puffin nubian parlez parlez parlez cause lazy rock lampin shade cause pay home girl say whirl beamer say nope cause schemer stay away hookers tryin cleaners rancho sanchero makin niro like style check better obey heed cause lazy crib piece cease amaze vocal release dukes knock door say store need green cornbread dread go store hop barber shop tell hook flat say sack say cool chilly chill spark roll talkin spark phillz nilz keep walkin normal right parlez parlez parlez cause lazy,118,0.000822368,0.000822368,0.092666875,0.000822368,0.000822368,0.000822368,0.000822368,0.000822368,0.4162318959165811,0.000822368,0.3808094367494594,0.000822368,0.000822368,0.000822368,0.000822368,obscene,0.3857142857142857
