artist_name,track_name,release_date,genre,lyrics,len,dating,violence,world/life,night/time,shake the audience,family/gospel,romantic,communication,obscene,music,movement/places,light/visual perceptions,family/spiritual,sadness,feelings,topic,age
joy division,i remember nothing,1979,rock,strangers strangers long long strangers violent long violent strangers weak time pass time world yeah gap enormous stare strangers long violent violent hand crack chair move reaction slump despair trap cage surrender soon world know long strangers strangers long strangers long long,42,0.002392345,0.1855020040486922,0.1503551274018688,0.5774710117349507,0.050786688,0.002392345,0.002392345,0.002392345,0.002392345,0.002392345,0.002392345,0.002392345,0.002392345,0.002392345,0.002392345,night/time,0.5857142857142857
t.g. sheppard,somewhere down the line,1979,country,know belong hold get feel time place tell look give sure meet place time line pretend night end leave home heart tell someday soon time lose wait dark resist place time line line matter time gonna line place time line place time line,43,0.00122399,0.00122399,0.00122399,0.3959942571420767,0.00122399,0.00122399,0.00122399,0.1507065996971651,0.00122399,0.00122399,0.1025917343143567,0.00122399,0.00122399,0.3069493314812171,0.00122399,night/time,0.5857142857142857
blondie,youth nabbed as sniper,1978,pop,sundown find overpass inner self glue dirty metal speed night light break glass heart destroy move streets lonely come hide sight fight nothingness wall little room hear parent friends action amend like kill know high crowd busy streets lonely come night fight emptiness black burn silent scream stop dream lightning crash crash crash fear cause live real cool die even school,61,0.001169591,0.4047879498888123,0.001169591,0.001169591,0.001169591,0.024409816,0.001169591,0.001169591,0.1911350244847409,0.001169591,0.001169591,0.2539036581384554,0.001169591,0.1093892815381836,0.001169591,violence,0.6
blondie,11:59,1978,pop,lean corner like candidate sidewalk social scientist satisfaction cigarette time run lock memories know today million years today want stay alive pump like fugitive cover night freeway like bullet ocean morning tomorrow hand highway like rocket ocean today million years today want stay alive hang frequency burn like motion get late tire lose control leave time run highway like rocket ocean today million years today want stay alive,68,0.000956938,0.1182587023565444,0.3171201793724664,0.1240233749275013,0.000956938,0.000956938,0.000956938,0.000956938,0.000956938,0.000956938,0.1564956113279067,0.000956938,0.000956938,0.000956938,0.000956938,world/life,0.6
pablo cruise,love will find a way,1978,pop,wrong think strong feel like fool poor think maybe say goodbye understand reason felt cool right right past pain past pain learn heart open cause feel need change rearrange dream feel like fall apart need brand start afraid true whoa right right past pain past pain learn heart open cause yeah afraid shine cause right right past pain past pain learn heart open cause right right past pain past pain learn heart open cause alright alright afraid cause alright alright alright alright heart open cause,85,0.000619195,0.000619195,0.1361622058198403,0.1055699153503949,0.063697867,0.012881445,0.015415107,0.072660841,0.000619195,0.000619195,0.000619195,0.014866003,0.000619195,0.4554283029700324,0.000619195,sadness,0.6
andrew gold,never let her slip away,1978,pop,talk baby telephone long distance guess miss yeah bout week matter heart know hop recover cause good slip away feel like teenage crush school school afternoon feel like lead yeah little dizzy little scar guess felt aware hop recover cause good slip away bout week matter heart know hop recover yeah good slip away think recover yeah good know gonna slip away know gonna slip away,66,0.0195396,0.000923361,0.000923361,0.000923361,0.074409366,0.047967624,0.000923361,0.2003850939559789,0.1588136099863643,0.000923361,0.000923361,0.000923361,0.000923361,0.3227828347182005,0.1260513422430688,sadness,0.6
the marshall tucker band,love is a mystery,1978,country,mystery answer question answer time answer think answer question heart feel inside mystery mystery fall heart know fall fall think gonna change ways fall fall fall heart know fall fall,30,0.001879699,0.001879699,0.001879699,0.001879699,0.001879699,0.001879699,0.001879699,0.4420425977008566,0.001879699,0.001879699,0.001879699,0.001879699,0.001879699,0.4901107762854205,0.001879699,sadness,0.6
van halen,you really got me,1978,rock,girl know doin girl sleep night yeah know goin yeah yeah sleep night want want girl know yeah sleep night girl know yeah sleep night yeah know goin yeah yeah sleep night,32,0.001594896,0.001594896,0.001594896,0.3168930703499203,0.2658108414797522,0.053666613,0.001594896,0.09361268,0.046575982,0.001594896,0.001594896,0.001594896,0.001594896,0.001594896,0.001594896,night/time,0.6
scorpions,top of the bill,1978,rock,roll chart blood cold get life roll crazy roll band spin head head thoughts star chart ohhhand roll chart fame roll game ohhhand,23,0.002923977,0.4099479141032067,0.002923977,0.002923977,0.002923977,0.002923977,0.002923977,0.002923977,0.002923977,0.059957076,0.002923977,0.082936502,0.002923977,0.002923977,0.002923977,violence,0.6
jona lewie,you'll always find me in the kitchen at parties,1978,pop,good chat rebuff drive drink wash leave stuff pile pile sink kitchen party girlfriend argue away home somebody live suppose kitchen party kitchen party kitchen party debutante say like wave cuisine cordon bleu haydn green luck kitchen party kitchen party pretty girl laugh talk walk kitchen dance time kitchen party time kitchen party time kitchen party time kitchen party time kitchen party time kitchen party,65,0.001283697,0.001283697,0.001283697,0.1421626387871056,0.001283697,0.001283697,0.001283697,0.001283697,0.4282455796081129,0.001283697,0.2743858069614979,0.001283697,0.001283697,0.001283697,0.053950634,obscene,0.6
warren zevon,accidentally like a martyr,1978,country,phone ring refuse shine think dearly long long time random abandon accidentally like martyr hurt get worse heart get harder random abandon accidentally like martyr hurt get worse heart get harder days slide sigh think lonely long long time time mind random abandon accidentally like martyr hurt get worse heart get harder random abandon accidentally like martyr hurt get worse heart get harder,63,0.001422475,0.001422475,0.001422475,0.3078420133341568,0.001422475,0.001422475,0.001422475,0.001422475,0.001422475,0.001422475,0.134633702,0.036269206,0.001422475,0.3596764170193525,0.001422475,sadness,0.6
siouxsie and the banshees,the staircase (mystery),1978,pop,stare lie face stare look slide banister escalator slide banister elevator stand land stand look assist solve mystery somebody assist arrange symmetry muffle footsteps carpet spiral step start spin floor ceiling balance floor ceiling upside stare lie face stare look,40,0.002506266,0.7362269609116362,0.002506266,0.002506266,0.002506266,0.002506266,0.002506266,0.002506266,0.002506266,0.002506266,0.002506266,0.002506266,0.002506266,0.002506266,0.050381753,violence,0.6
tanya tucker,don't believe my heart can stand another you,1978,country,believe heart stand need gentle kind true game play rough believe heart stand people world stand door tell leave know leave think come conclusion believe heart stand try know knees help get complicate believe heart stand believe heart stand need gentle kind true game play rough believe heart stand believe heart stand need gentle kind true yeah game play damn rough believe heart stand believe heart stand,67,0.000835422,0.1073363809911583,0.2064796673113599,0.000835422,0.043270227,0.000835422,0.000835422,0.3252095081751159,0.000835422,0.000835422,0.000835422,0.000835422,0.000835422,0.3060083094835641,0.000835422,sadness,0.6
kenny rogers,making music for money,1978,country,wake morning tire think count money count sheep agent call tell music money instead make music say know sound funny money mean nothin music money gonna music say people songs roll long say commerical want turn people say turn people beautiful place spend time makin memorable rhyme gonna turn say know sound funny money mean nothin music money gonna music go country tell scene place charm untouched music machine people havin good time makin music long care pay playin song say know sound funny money mean nothin music money gonna music,91,0.000626566,0.000626566,0.000626566,0.000626566,0.000626566,0.000626566,0.000626566,0.241694557,0.3310900376376205,0.2453693507536101,0.054494679,0.000626566,0.022691035,0.000626566,0.023218326,obscene,0.6
billy joel,stiletto,1978,rock,cut cut twice believe wind fresh taste blood strength leave buy sell lock outside door stand plead insides bleed cause deep want say want forgiveness clever masquerade good stiletto blade blade cut hard cut deep skill fascinate wait come kill slash face leave bleed want away know gonna stay cause give need say need affection search vein good stiletto mind pain mind pain cut cut carve life keep cut cause know knife buy sell lock outside door stand plead insides bleed cause deep want say need affection search vein good stiletto mind pain mind pain,95,0.000797448,0.3147252357524896,0.062452129,0.000797448,0.032860924,0.000797448,0.000797448,0.1403440280923579,0.000797448,0.000797448,0.067410867,0.000797448,0.000797448,0.2399581399455739,0.045358513,violence,0.6
the blues brothers,"""b"" movie box car blues",1978,blues,seven hours days take away night sleep take away go want whomever choose dinner restaurant say away blue cause compare compare lonely like sing stop lonely tear fall tell baby wrong arm remind go doctor guess tell guess tell say girl better matter fool cause compare compare flower plant mama die go away know live baby hard will compare compare compare compare compare compare,64,0.047297234,0.001052632,0.050251963,0.001052632,0.001052632,0.030085518,0.001052632,0.2648706581591826,0.001052632,0.087574072,0.1280855630995847,0.001052632,0.001052632,0.3306517011494059,0.001052632,sadness,0.6
the outlaws,falling rain,1978,blues,treat like miss miss think inside mind play time baby good cry needlessly baby forget soul phone win turn lose whiskey cure blue sayin baby look like fall rain forget tomorrow ease pain look like fall rain forget tomorrow ease pain baby good cry needlessly look like look like look like gonna shine look like fall fall rain,58,0.1006027268736794,0.000956938,0.000956938,0.08109598,0.000956938,0.000956938,0.000956938,0.000956938,0.000956938,0.031524476,0.0263797,0.027428526,0.000956938,0.3271010580847232,0.07516651,sadness,0.6
don williams,all i'm missing is you,1978,country,place like things like familiar face know miss get cause go miss memories strong dream come true feel go miss get cause go miss instrumental get cause go miss instrumental fade,31,0.001814882,0.001814882,0.081455623,0.001814882,0.001814882,0.001814882,0.001814882,0.203856343,0.001814882,0.001814882,0.001814882,0.001814882,0.001814882,0.1621615636924273,0.4381958743792897,feelings,0.6
johnny clarke,i man come again,1978,reggae,throw hand hear talk bout band brother shhh hammer damn bruh answer go live front camera hartford great swear bring bellevue square wanna mural brick bellevue proof cuss like start say hartford pardon champion like starling magic hold phone tryna like shazam leave eye swolled nose bloody word cuyler need iceman like scully city shall fear peace live square hook purse city real hitters go hard like brothers like cloth legend respect ones come blueprint hartford great open door real music peace live square run think gucci hear foot work like guilio gallucci curve school like wortham thang come superb give shoot sillier ball pocket like billiard block prop feel loud hard like yeah fight night start come ring bout starks like pookieagod hand awesome scoop truck like scream cream hardcore swift floor booze snype wanna hook purse city real hitters go hard like brothers like cloth legend respect ones come blueprint hartford great open door real music peace live square,161,0.000526316,0.076651042,0.062586772,0.000526316,0.015874166,0.000526316,0.000526316,0.000526316,0.3277545223228091,0.064211695,0.1826097293375962,0.000526316,0.120499735,0.000526316,0.041076589,obscene,0.6
jim morrison,a feast of friends,1978,rock,sick doubt live light certain south cruel bind servants power dogmen mean women pull poor blanket sailors sick dour face star tower want roses garden bower baby rubies replace abort strangers mutants bloodmeal plant plow wait sever garden know pale wanton thrillful come death strange hour unannounced unplanned like scar overfriendly guest bring death make angels give wing shoulder smooth claw money dress kingdom best reveal incest loose obedience vegetable prefer feast friends giant family,75,0.041030467,0.3948800719023903,0.001385042,0.001385042,0.001385042,0.001385042,0.001385042,0.1070441654760447,0.001385042,0.001385042,0.193459355,0.1643358642122311,0.058465694,0.001385042,0.001385042,violence,0.6
the rolling stones,lies,1978,rock,lie drip mouth like dirt lie lie step walk lie whisper sweetly lie cruel lie lie lie fool lie lie papa look lie lie history book lie lie like teach class lie lie lie catch fast wicked tongue lie lie lie try spoil lie lie dirty jezebel hell think fool lie lie lie rule lie lie lie lie lie,59,0.001031992,0.7463433176299904,0.001031992,0.001031992,0.001031992,0.001031992,0.001031992,0.2361128220898865,0.001031992,0.001031992,0.001031992,0.001031992,0.001031992,0.001031992,0.001031992,violence,0.6
atlanta rhythm section,large time,1978,country,proud livin playin guarantee large time knock drag ball large large time play macon lynyrd skynyrd roll hoedown zant freebird know wasn foolin large time shoulda hear guitars squall large real large time sure ball proud livin playin guarantee large time knock drag ball large large time play macon lynyrd skynyrd roll hoedown zant freebird know wasn foolin large time shoulda hear guitars squall large real large time sure ball,70,0.001422475,0.001422475,0.001422475,0.2091989694079683,0.001422475,0.001422475,0.001422475,0.070331777,0.4993485911202125,0.001422475,0.1997835351443118,0.001422475,0.001422475,0.001422475,0.001422475,obscene,0.6
foreigner,starrider,1977,rock,steal ride pass know go near years light land future past heavenly sight starrider rider rider star starrider rider rider northern light flash go star ones bear sail celestial ways light years shine rest days speed increase control hand know help grow starriders starrider rider rider starrider rider rider star,50,0.001594896,0.001594896,0.3309024197970255,0.001594896,0.001594896,0.001594897,0.001594896,0.001594896,0.001594896,0.001594896,0.1067053839889511,0.3901469783219208,0.077039544,0.001594896,0.041921775,world/life,0.6142857142857143
bonnie raitt,runaway,1977,pop,walk wonder go wrong strong walk think things hearts young walk rain tear fall feel pain wish misery wonder wonder away wonder stay little runaway runaway instrumental break walk rain tear fall feel pain wish misery wonder wonder baby yeah know away wonder stay little runaway little runaway come baby runaway leave standin rain runaway come baby runaway fade,59,0.099977021,0.001031992,0.001031992,0.001031992,0.020750682,0.061310035,0.001031992,0.1140411397325201,0.001031992,0.001031992,0.001031992,0.001031992,0.02365625,0.5836187642163218,0.036719385,sadness,0.6142857142857143
wire,ex lion tamer,1977,pop,great danger danger loneliest ranger silver bullets bullets tonto split scene week solve problems fish finger line milk bottle stand stay glue great danger danger hand cap crusader cloak justice justice quit scene week solve problems fish finger line milk bottle stand stay glue stay glue stay glue stay glue stay glue stay glue stay glue stay glue stay glue,60,0.001754386,0.069442932,0.001754386,0.3625542019886984,0.001754386,0.001754386,0.001754386,0.001754386,0.001754386,0.001754386,0.5399326892535823,0.001754386,0.001754386,0.001754386,0.001754386,night/time,0.6142857142857143
patti austin,we're in love,1977,jazz,feel good dear lie arm good know fireÃ¢ burninÃ¢ feel warmth deep inside good know thereÃ¢ kind magic feel thereÃ¢ kind magic oohÃ¢ oohÃ¢ thereÃ¢ kind touch let know feel magic time know get sweeter better good know good know good know good know thereÃ¢ kind magic feel thereÃ¢ kind magic oohÃ¢ oohÃ¢ thereÃ¢ kind touch let know feel magic time know get sweeter better good know good know good know good know good know good know lalalalala lalalalala lalalalala good know good know good know good know darlinÃ¢ good know good know,93,0.000701754,0.000701754,0.000701754,0.000701754,0.000701754,0.000701754,0.051531931,0.4703716882655642,0.000701754,0.000701754,0.000701754,0.1049063624759305,0.000701754,0.000701754,0.362663702,feelings,0.6142857142857143
the jam,life from a window,1977,pop,look hilltop watch lighthouse dream world look nice life window take view life window observe star grey try paint blue teenage blue life window take view life window watch people tell devote tell sunday come monday change mind look skyscraper stand post office tower life window take view life window watch look skyscraper stand post pffice tower,57,0.00122399,0.00122399,0.3533779836599677,0.00122399,0.00122399,0.00122399,0.00122399,0.053921648,0.00122399,0.030584142,0.4065867193216931,0.1155993474123737,0.00122399,0.00122399,0.00122399,world/life,0.6142857142857143
shaun cassidy,take good care of my baby,1977,pop,tear fallin cause takin away hurt somethin gotta sayay good careare baby blueue tell sure thinkin dooo good careare baaaby crywhy surround herer paint rainbow herer cloudy skywhy time little girl miine true know good careare baaaby kiind beee discover send baaby home good careare baaaby kiind beee discover send baaby home good careare baaaby send good careare baaaby cause miss baby good careare baaaby good careare baaaby,68,0.1094418048596334,0.001594896,0.001594896,0.001594897,0.001594896,0.038487086,0.001594896,0.094238799,0.1575902041755029,0.069515183,0.001594896,0.001594896,0.074287477,0.1069607942171677,0.3010682568205478,feelings,0.6142857142857143
dennis wilson,all alone,1977,country,live life wrong better know spend life know soul standin live life belong strong time understand go sadness leave stand stand plant seed know grow share life grow go sadness leave stand,32,0.001879699,0.001879699,0.6652082206374439,0.001879699,0.001879699,0.001879699,0.001879699,0.227213467,0.001879699,0.001879699,0.001879699,0.001879699,0.001879699,0.001879699,0.077503123,world/life,0.6142857142857143
peter tosh,jah guide,1977,reggae,tread valley fear evil tread valley fear evil cause know guide guide guide guide guide valley know trodding valley know enemies fight everyday fear evil enemies trap fear evil cause guide guide guide guide guide valley know trodding valley know pretty workers pit fear evil pretty workers fight everyday fear evil cause guide guide guide guide guide valley know trodding valley know pestilence lurk dark place fear evil destruction walk smile face fear evil cause guide guide guide guide guide valley know trodding valley know walk streets know smoke pipe know trodding earth know drive road know pit know fight everyday know know,103,0.00093985,0.4453600165838837,0.00093985,0.00093985,0.00093985,0.00093985,0.00093985,0.4270491496531426,0.00093985,0.00093985,0.042256838,0.00093985,0.00093985,0.00093985,0.00093985,violence,0.6142857142857143
queen,it's late,1977,rock,hardly know candlelight blame inside turn mind away stay late bleed deep inside late sickly pride late feel steal away late cry help hear late late late late sweetest time try tell leave believe true know know true tell late drive late know tell late save turn light late wrong learn right late late late late long long long try work long long gotta know life tell work yeah late yeah late late star suspicion game play say know reply tonight make life wonder live life right late time free late know late body night late water guilt tide late late late late late late late late whoa late come late late yeah whoa,114,0.000491884,0.000491884,0.092543339,0.4640965991291695,0.05043409,0.000491884,0.000491884,0.2124991927957025,0.000491884,0.000491884,0.000491884,0.000491884,0.010174512,0.1319125937858086,0.000491884,night/time,0.6142857142857143
nazareth,shot me down,1977,blues,feelin good kinda high cruisin tryin forget losin come surprise surprise shoot lyin crash grind shoot feelin fine mellow easy comin kinda slow lazy come fire flame shoot lyin burn grind shoot shoot shoot feelin good kinda high cruisin tryin forget losin come surprise surprise shoot lyin crash grind shoot shoot shoot word music mccafferty agnew sweet copyright musicinc copyright nazsongspanache music rest world international copyright secure right reserve,69,0.001052632,0.3974958355571035,0.036787837,0.001052632,0.001052632,0.001052632,0.001052632,0.001052632,0.2634895157795574,0.067849275,0.001052632,0.083062147,0.001052632,0.001052632,0.063453133,violence,0.6142857142857143
bob andy,stepping free,1977,reggae,behold trust shield traitor friends near enemies closer behold trust betrayal lurk corner wall mind collect focus crash collapse word crackle burn paper speak know walk step ahead word like knives word sharp razor surrender fear freedom remember choose path sure prepare life throw know chance battle merit difference saviour crash collapse word crackle burn paper speak know walk step ahead word like knives word sharp razor surrender fear freedom live tomorrow learn live forever stay awake world sleep free disappear,81,0.000974659,0.4855063394757985,0.2506000912873843,0.037297736,0.000974659,0.000974659,0.000974659,0.1525155233913437,0.000974659,0.000974659,0.000974659,0.000974659,0.060435085,0.000974659,0.000974659,violence,0.6142857142857143
daryl hall & john oates,rich girl,1976,rock,girl go cause know matter rely money rely money bitch girl go cause know matter money know know wrong give go strong strong cause girl go cause know matter rely money rely money bitch girl go cause know matter money high rain easy hurt feel pain know grow cause cause live thrill girl go cause know matter rely money rely money bitch girl go cause know matter money money money rely money rely money girl girl bitch girl money,79,0.000730994,0.000730994,0.040686077,0.000730994,0.000730994,0.000730994,0.015568737,0.2353352983735898,0.3839953533486413,0.000730994,0.000730994,0.000730994,0.000730994,0.000730994,0.1477556591765954,obscene,0.6285714285714286
marty robbins,mister teardrop,1976,country,mister teardrop fall away mister teardrop fall tell friends go tell little lie drop scene disguiseise mister teardrop fall away smile tell friends go tell little lie drop scene disguiseise mister teardrop fall away smile,35,0.002024292,0.002024292,0.002024292,0.002024291,0.002024292,0.083925877,0.002024292,0.2862236187965767,0.1569521814539461,0.002024292,0.002024292,0.002024292,0.002024292,0.3888867227497381,0.055671518,sadness,0.6285714285714286
aswad,back to africa,1976,reggae,africa africa open eye land africa place free africa hear africa leave critical state late free persecutions free wicked babylon africa hear africa come africa africa hear see destiny time forget past misery lord gonna hearts hearts africa africa africa africa,41,0.002192983,0.002192983,0.002192983,0.06928839,0.002192982,0.044311231,0.002192982,0.002192983,0.002192983,0.1431877486169058,0.002192983,0.002192983,0.2701287657558486,0.400681471,0.002192982,sadness,0.6285714285714286
thin lizzy,borderline,1976,blues,midnight city drink think girl go wrong mister tell save room boys tell borderline borderline time borderline time seven beers sober time change stronger scene longer tell home place time cast spell borderline time borderline time mister till crazy turn mind pass bottle time slowly sink tell shame disgrace rejection borderline borderline time borderline time hand knees crawl beg darling time know risk take leave forsake time,67,0.001096491,0.078330605,0.05005412,0.3037535734886135,0.001096491,0.001096491,0.029445546,0.1852283960715899,0.001096491,0.001096491,0.3115962761203361,0.001096491,0.001096491,0.001096491,0.001096491,night/time,0.6285714285714286
peter frampton,jumping jack flash,1976,country,bear crossfire hurricane howl drive rain right fact right jumpin flash school strap right raise toothless beard right fact right jumpin flash drown beat leave dead look feet bleed right fact right jumpin flash jumpin flash,36,0.001949318,0.4947760210314684,0.001949318,0.2877279550744734,0.001949318,0.001949318,0.001949318,0.001949318,0.001949318,0.001949318,0.1493843847651087,0.001949318,0.001949318,0.001949318,0.001949318,violence,0.6285714285714286
billy joel,prelude / angry young man,1976,rock,place world angry young work class tie radical plan refuse bend refuse crawl home wall proud scar battle lose struggle bleed hang cross like know angry young moment angry young foot mouth heart hand stab misunderstand comfort know intentions good sit room lock door map medals lay floor like know angry young believe pass consciousness righteous rage survive fight believe cause pointless point view life go matter wrong right place angry young fist head sand able learn mistake understand heart break pure courage fair true bore hell grave angry place angry young work class tie radical plan refuse bend refuse crawl home wall proud scar battle lose struggle bleed hang cross like know angry young,115,0.000649773,0.3338574709700694,0.1517084296762688,0.000649773,0.000649773,0.000649773,0.000649773,0.1154991007008695,0.000649773,0.000649773,0.2390665045341199,0.000649773,0.096180968,0.055240482,0.000649773,violence,0.6285714285714286
